ATU_Number,Title,Category,Subsection,Status,Exemplar_Tales,Sources,Notes
1889,,Anecdotes and Jokes,Tall Tales,unassigned,,,Parent number has no main type; only the lettered subtypes 1889A-1889P are attested (overwhelmingly Münchhausen-derived).
1890,The Lucky Shot,Anecdotes and Jokes,Tall Tales,active,"""Münchhausen"" cluster (Raspe, 1785)",Claude (model knowledge),
1891,The Great Catch of Fish,Anecdotes and Jokes,Tall Tales,active,—,Claude (model knowledge),
1892-1893,,Anecdotes and Jokes,Tall Tales,unassigned,,,
1894,Man Shoots a Ramrod Full of Ducks,Anecdotes and Jokes,Tall Tales,active,Overlap with 1890D,Claude (model knowledge),
1895,A Man Wading in Water Catches Many Fish in His Boots,Anecdotes and Jokes,Tall Tales,active,—,Claude (model knowledge),
1896,Hunting With a Ramrod,Anecdotes and Jokes,Tall Tales,active,—,Claude (model knowledge),
1897-1899,,Anecdotes and Jokes,Tall Tales,unassigned,,,
1900,How the Man Came Out of a Tree Stump,Anecdotes and Jokes,Tall Tales,active,—,Claude (model knowledge),
1901-1909,,Anecdotes and Jokes,Tall Tales,unassigned,,,
1910,The Bear (Wolf) in the Plough,Anecdotes and Jokes,Tall Tales,active,—,Claude (model knowledge),
1911,The Horse's New Legs,Anecdotes and Jokes,Tall Tales,active,"""Münchhausen"" half-horse / horse-cut-in-half-and-grafted (Raspe)",Claude (model knowledge),
1912-1919,,Anecdotes and Jokes,Tall Tales,unassigned,,,
1920,Contest in Lying,Anecdotes and Jokes,Tall Tales,active,"""Lügenmärchen"" (German lying-tale) tradition; Grimm KHM 159 ""Das Märchen vom Schlaraffenland"" / ""The Tale About the Land of Cockaigne""; ""Diet- mar Lügenmaul"" tradition",Claude (model knowledge),Parent type for the lying-contest cycle; biggest liar wins.
1921,,Anecdotes and Jokes,Tall Tales,unassigned,,,
1922-1929,,Anecdotes and Jokes,Tall Tales,unassigned,,,
1930,Schlaraffenland (Cockaigne),Anecdotes and Jokes,Tall Tales,active,"""Das Märchen vom Schlaraffenland"" / ""The Tale About the Land of Cockaigne"" (Grimm KHM 158); medieval ""Le Fabliau de Cocaigne"" (13th c. French); ""The Land of Cockaigne"" (Middle English poem); Pieter Bruegel the Elder painting (1567, visual descendant)",Claude (model knowledge),Lying-tale describing a paradise of food and idleness.
1931-1959,,Anecdotes and Jokes,Tall Tales,unassigned,,,
1960,The Great Animal,Anecdotes and Jokes,Tall Tales,active,"American tall-tale tradition; ""The Great Buck"" / ""The Great Bear"" hunter-stories",Claude (model knowledge),
1961,The Great Wedding,Anecdotes and Jokes,Tall Tales,active,—,Claude (model knowledge),
1962,The Great Famine (Cold Spell),Anecdotes and Jokes,Tall Tales,active,—,Claude (model knowledge),
1963,,Anecdotes and Jokes,Tall Tales,unassigned,,,
1964-1999,,Anecdotes and Jokes,Tall Tales,unassigned,,,End of Tall Tales subsection. End of Anecdotes and Jokes category. Catalogue resumes at 2000 opening Formula Tales.
2000,Cumulative Tales (parent type),Formula Tales,Cumulative Tales,active,Parent type covering cumulative tales broadly,Claude (model knowledge),Cumulative tale is a chain-tale where each episode adds to the previous; see lettered subtypes and 2010-2075 range.
2001-2009,,Formula Tales,Cumulative Tales,unassigned,,,Gap between cumulative-tales parent type (2000) and first enumerated subtype (2010).
2010,Ehod Mi Yodea (Who Knows One?),Formula Tales,Cumulative Tales,active,"""Ehad Mi Yodea"" / ""Who Knows One?"" (Passover Haggadah, Hebrew counting-song, medieval Ashkenazi); ""The Twelve Days of Christmas"" (English carol, structural parallel, 1780 first printed)",Claude (model knowledge),Counting cumulative tale; each verse adds a numbered item from 1 to 12 or 13.
2011-2014,,Formula Tales,Cumulative Tales,unassigned,,,Gap between 2010 counting-song subtypes and 2015 cluster.
2015,The Goat Who Would Not Go Home,Formula Tales,Cumulative Tales,active,"""The Old Woman and Her Pig"" (English, Jacobs); ""Stan Bolovan"" (Romanian) related; German ""Der Pfarrer und der Küster""",Claude (model knowledge),Woman must fetch a series of helpers to get the goat/pig over the stile and home.
2016,,Formula Tales,Cumulative Tales,unassigned,,,
2017,,Formula Tales,Cumulative Tales,unassigned,,,
2018,,Formula Tales,Cumulative Tales,unassigned,,,
2019,,Formula Tales,Cumulative Tales,unassigned,,,
2020,,Formula Tales,Cumulative Tales,unassigned,,,
2021,The Cock and Hen: Death of Friend,Formula Tales,Cumulative Tales,active,"""Von dem Tod des Hühnchens"" / ""The Death of the Little Hen"" (Grimm KHM 80); Scandinavian ""The Cock and Hen That Went to the Dovrefjell"" (Asbjørnsen & Moe)",Claude (model knowledge),
2022,An Animal Mourns the Death of His Spouse,Formula Tales,Cumulative Tales,active,—,Claude (model knowledge),
2023,Little Ant Finds a Penny,Formula Tales,Cumulative Tales,active,"""The Ant and the Snow"" / ""La Hormiguita"" (Spanish); ""The Mouse Who Wanted to Marry"" (widespread Mediterranean); ""Perez the Mouse"" tradition",Claude (model knowledge),
2024,,Formula Tales,Cumulative Tales,unassigned,,,
2025,The Fleeing Pancake,Formula Tales,Cumulative Tales,active,"""The Gingerbread Man"" (American, published 1875 in St. Nicholas Magazine); ""The Gingerbread Boy""; ""The Pancake"" / ""Pannekaken"" (Asbjørnsen & Moe, Norwegian); ""Kolobok"" (Russian, Afanasyev); ""The Runaway Bun"" variants; ""Johnny-Cake"" (Jacobs, English)",Claude (model knowledge),One of the most widely distributed cumulative tales globally; food escapes pursuers until outwitted by fox/cunning final figure.
2026,,Formula Tales,Cumulative Tales,unassigned,,,
2027,The Fat Cat,Formula Tales,Cumulative Tales,active,"""The Cat Who Ate Everything"" (Danish ""Den lille Kat og den store Kat"", Asbjørnsen & Moe tradition); ""The Fat Cat"" (Margaret Read MacDonald retelling, 1978)",Claude (model knowledge),
2028,The Troll (Wolf) Who Was Cut Open,Formula Tales,Cumulative Tales,active,"""The Wolf and the Seven Young Kids"" partial overlap (Grimm KHM 5, type 123); ""Little Red Riding Hood"" Grimm ending (type 333)",Claude (model knowledge),
2029,,Formula Tales,Cumulative Tales,unassigned,,,
2030,The Old Woman and Her Pig,Formula Tales,Cumulative Tales,active,"""The Old Woman and Her Pig"" (Jacobs, English Fairy Tales, 1890); ""This Is the House That Jack Built"" (English nursery tradition, 1755) structural parallel; ""Had Gadya"" (Jewish, structural parallel)",Claude (model knowledge),Classic chain-tale; old woman must get help from a series of creatures/objects to complete a task.
2031,Stronger and Strongest,Formula Tales,Cumulative Tales,active,"""The Stonecutter"" (Japanese); ""The Mouse Who Wanted to Marry"" (Panchatantra, Sanskrit, literary antecedent, c. 300 CE); ""The Rat's Bridegroom"" (widespread Asian); Jean de La Fontaine ""Le Rat et la Grenouille"" analogues",Claude (model knowledge),Chain of 'who is stronger than X?' leading back to the starting creature; classic philosophical paradox cumulative.
2032,The Cock's Whiskers,Formula Tales,Cumulative Tales,active,—,Claude (model knowledge),
2033,A Nut Hits the Cock's Head,Formula Tales,Cumulative Tales,active,"""Chicken Little"" / ""Henny Penny"" (English, Jacobs); ""The Sky Is Falling"" tradition",Claude (model knowledge),Classic alarmist-chain tale ending in fox-trick.
2034,The Mouse Regains Its Tail,Formula Tales,Cumulative Tales,active,—,Claude (model knowledge),
2035,The House Is Burning,Formula Tales,Cumulative Tales,active,"""This Is the House That Jack Built"" (English, first printed 1755 in ""Nurse Truelove's New-Year's Gift"")",Claude (model knowledge),
2036,,Formula Tales,Cumulative Tales,unassigned,,,
2037,,Formula Tales,Cumulative Tales,unassigned,,,
2038,,Formula Tales,Cumulative Tales,unassigned,,,
2039,,Formula Tales,Cumulative Tales,unassigned,,,
2040-2074,,Formula Tales,Cumulative Tales,unassigned,,,
2075,Tales in Which Animals Talk,Formula Tales,Cumulative Tales,active,—,Claude (model knowledge),
2076-2099,,Formula Tales,Cumulative Tales,unassigned,,,End of Cumulative Tales subsection.
2100-2199,,Formula Tales,Other Formula Tales / Catch Tales,unassigned,,,Empty range between Cumulative Tales and the main Catch Tales numbering.
2200,Catch-Tale,Formula Tales,Other Formula Tales / Catch Tales,active,Parent type for catch-tales (tales with joke/trick ending that invites hearer's response),Claude (model knowledge),
2201,Catch-Tale about an Animal,Formula Tales,Other Formula Tales / Catch Tales,active,—,Claude (model knowledge),
2202,Teller is Killed in His Own Story,Formula Tales,Other Formula Tales / Catch Tales,active,—,Claude (model knowledge),
2203,The Tailor's Last Message,Formula Tales,Other Formula Tales / Catch Tales,active,—,Claude (model knowledge),
2204,The Rat-Catcher,Formula Tales,Other Formula Tales / Catch Tales,active,—,Claude (model knowledge),
2205,The Fearless Knight,Formula Tales,Other Formula Tales / Catch Tales,active,—,Claude (model knowledge),
2206-2249,,Formula Tales,Other Formula Tales / Catch Tales,unassigned,,,
2250,Unfinished Tales (Endless Tale),Formula Tales,Other Formula Tales / Catch Tales,active,"""The Endless Tale"" tradition; ""The Story of the Man Who Lived a Hundred Years"" (1001 Nights framing overlap)",Claude (model knowledge),"Parent type for endless tales; story never resolves, frustrating the listener as its point."
2251,The Tale About the Unfinished Bridge,Formula Tales,Other Formula Tales / Catch Tales,active,—,Claude (model knowledge),
2252,,Formula Tales,Other Formula Tales / Catch Tales,unassigned,,,
2253-2299,,Formula Tales,Other Formula Tales / Catch Tales,unassigned,,,
2300,Endless Tales (Proper),Formula Tales,Other Formula Tales / Catch Tales,active,"""The Endless Tale"" tradition worldwide; characteristic of oral traditions meant to deliberately frustrate listeners demanding 'just one more story'",Claude (model knowledge),
2301,The Thousand and One Sheep (Ram Crossing Stream),Formula Tales,Other Formula Tales / Catch Tales,active,1001 Nights framing story (the sheep-crossing-a-stream as stalling-tale); Sindibad-tradition stalling-tales,Claude (model knowledge),Endless tale: narrator describes sheep crossing stream one by one; tale cannot continue until all sheep cross.
2302,Moving the Grains of Salt (Corn) One by One,Formula Tales,Other Formula Tales / Catch Tales,active,—,Claude (model knowledge),
2303,,Formula Tales,Other Formula Tales / Catch Tales,unassigned,,,
2304,,Formula Tales,Other Formula Tales / Catch Tales,unassigned,,,
2305,,Formula Tales,Other Formula Tales / Catch Tales,unassigned,,,
2306-2319,,Formula Tales,Other Formula Tales / Catch Tales,unassigned,,,
2320,Rounds (Round Songs and Tales with Circular Structure),Formula Tales,Other Formula Tales / Catch Tales,active,"""The Bear Went Over the Mountain"" structural parallel; ""It was a dark and stormy night"" recursive-tale tradition",Claude (model knowledge),
2321,Tale That Returns Endlessly to Its Beginning,Formula Tales,Other Formula Tales / Catch Tales,active,"""It was a dark and stormy night"" frame-tale (widely cited as emblematic recursive story); 1001 Nights framing structure",Claude (model knowledge),
2322,,Formula Tales,Other Formula Tales / Catch Tales,unassigned,,,
2323-2334,,Formula Tales,Other Formula Tales / Catch Tales,unassigned,,,
2335,Tales Filled with Contradictions,Formula Tales,Other Formula Tales / Catch Tales,active,"""The Tale of Sir Thopas"" (Chaucer, Canterbury Tales, literary descendant uses contradictory / deliberately bad storytelling as comedy)",Claude (model knowledge),
2336-2349,,Formula Tales,Other Formula Tales / Catch Tales,unassigned,,,
2350-2399,,Formula Tales,Other Formula Tales / Catch Tales,unassigned,,,End of Other Formula Tales / Catch Tales subsection. End of Formula Tales category. End of ATU index (2004).
1920A,The Sea Burns,Anecdotes and Jokes,Tall Tales,active,—,Claude (model knowledge),
1920B,"The One Says: """"I Have Not Time to Lie""""",Anecdotes and Jokes,Tall Tales,active,—,Claude (model knowledge),
2031A,The Mouse Seeks a Bride,Formula Tales,Cumulative Tales,active,"""The Mouse's Wedding"" / ""Nezumi no yomeiri"" (Japanese); Panchatantra antecedent",Claude (model knowledge),
1911A,How the Lost Horse Was Found,Anecdotes and Jokes,Tall Tales,active,—,Claude (model knowledge),
1889D,Lying Hunting Tale,Anecdotes and Jokes,Tall Tales,active,—,Claude (model knowledge),
1889E,Pulling Oneself Out of the Bog by One's Own Hair,Anecdotes and Jokes,Tall Tales,active,"""Münchhausen"" pulling-self-from-swamp-by-bootstraps episode (Raspe) — origin of the English idiom 'bootstrap'",Claude (model knowledge),
1889F,Frozen Words (Music) Thaw,Anecdotes and Jokes,Tall Tales,active,"""Münchhausen"" frozen-trumpet-call-thaws-in-spring (Raspe); Plutarch antecedent; Rabelais 'frozen words at sea' (Quart Livre, ch. 55-56, literary)",Claude (model knowledge),
1889G,Man Swallowed by Fish,Anecdotes and Jokes,Tall Tales,active,"Jonah biblical antecedent; ""Münchhausen"" whale episode (Raspe); Pinocchio (Collodi, literary)",Claude (model knowledge),
1889H,Submarine Otherworld,Anecdotes and Jokes,Tall Tales,active,—,Claude (model knowledge),
1889K,The Hunter Catches Animals by Singular Means,Anecdotes and Jokes,Tall Tales,active,—,Claude (model knowledge),
1889L,The Lie: Lightning Travels Slowly,Anecdotes and Jokes,Tall Tales,active,—,Claude (model knowledge),
1889M,Snakebite Causes Object to Swell,Anecdotes and Jokes,Tall Tales,active,American tall-tale tradition; Paul Bunyan and Pecos Bill cycles (literary),Claude (model knowledge),
1911B,Tail Pulls Off,Anecdotes and Jokes,Tall Tales,active,—,Claude (model knowledge),
1889N,The Long Hunting Trip,Anecdotes and Jokes,Tall Tales,active,—,Claude (model knowledge),
1890A,Shot Splits Tree-Limb and Catches Bird's Feet,Anecdotes and Jokes,Tall Tales,active,—,Claude (model knowledge),
1890B,Wild Boars Caught in Cleft Tree,Anecdotes and Jokes,Tall Tales,active,—,Claude (model knowledge),
1890C,Gun-Barrel Bent to Make Spectacular Shot,Anecdotes and Jokes,Tall Tales,active,—,Claude (model knowledge),
1890D,Ramrod Shot Plus Series of Lucky Accidents,Anecdotes and Jokes,Tall Tales,active,—,Claude (model knowledge),
1890E,Gun Misfires; Hunter Carves Bullets from His Knife,Anecdotes and Jokes,Tall Tales,active,—,Claude (model knowledge),
1890F,Shot in the Right Eye but Where the Tail Was Pointing,Anecdotes and Jokes,Tall Tales,active,—,Claude (model knowledge),
2A,Torn-off Tails,Animal Tales,Wild Animals: The Clever Fox (Other Animal),active,Knotter of Tails (Arab tradition); Tailless Fox tales,https://libraryguides.missouri.edu/c.php?g=1083510,Subsumes former AT 64 'Fox without a Tail / Tailless Fox Tries in Vain to Get Foxes to Cut off Tails' per Uther 2004.
1896A,The Frog That Burst,Anecdotes and Jokes,Tall Tales,active,"Aesop, ""The Frog and the Ox"" (Perry Index 376)",Claude (model knowledge),
1889P,Hunter's Lie: Game Speaks,Anecdotes and Jokes,Tall Tales,active,—,Claude (model knowledge),
1920C,The Master and the Peasant: Truth and Falsehood,Anecdotes and Jokes,Tall Tales,active,—,Claude (model knowledge),
68A,The Jug as Trap,Animal Tales,Wild Animals: The Clever Fox (Other Animal),active,—,https://libraryguides.missouri.edu/c.php?g=1039894&p=7609090,Motif J2131.5.7. Fox trying to drown jug.
1920E,Lying Contest: Magic Bird,Anecdotes and Jokes,Tall Tales,active,—,Claude (model knowledge),
327G,The Boy at the Witch's (Ogre's) House,Tales of Magic,Supernatural Adversaries,active,—,Manchester Hive tale-type index; Missouri Libraries,
327F,The Witch and the Fisher Boy,Tales of Magic,Supernatural Adversaries,active,—,Wikipedia: Hansel and Gretel; Missouri Libraries Folk Tales Online,
1962A,The Great Flood,Anecdotes and Jokes,Tall Tales,active,—,Claude (model knowledge),
327E,,Tales of Magic,Supernatural Adversaries,uncertain,,,Some sources list subtype E; not consistently documented in open sources.
327D,The Kiddlekaddlekar,Tales of Magic,Supernatural Adversaries,active,European oral tradition variants involving magic cart and ogre's self-hanging,Wikipedia: Hansel and Gretel; Wikiwand: Hansel and Gretel,
327C,The Devil (Witch) Carries the Hero Home in a Sack,Tales of Magic,Supernatural Adversaries,active,Russian variants (Baba Yaga carries boy in sack); various Slavic tales,Wikipedia: Hansel and Gretel; Wikiwand: Hansel and Gretel; Ashliman type 327C,
327B,The Brothers and the Ogre (Thumbling / Le Petit Poucet),Tales of Magic,Supernatural Adversaries,active,"""Le Petit Poucet"" / ""Hop-o'-My-Thumb"" (Perrault); ""Molly Whuppie"" (Jacobs, English); ""Maol a Chliobain"" (Campbell, Scottish); ""Esben and the Witch"" (Danish, Lang Pink Fairy Book); ""Mutsmag"" (Appalachian); ""Big Peter and Little Peter"" (Norwegian)",Wikipedia: Hop-o'-My-Thumb; Wikipedia: Molly Whuppie; SurLaLune; Ashliman type 327B,
178A,The Brahmin and the Mongoose,Animal Tales,Wild Animals and Humans,active,The Brahmin and the Mongoose (Panchatantra); Llewellyn and Gelert (Welsh),https://sites.pitt.edu/~dash/type0178a.html,Faithful animal kills snake to save baby; owner kills animal by mistake thinking it hurt the child.
178B,The Faithful Dog as the Rescuer,Animal Tales,Wild Animals and Humans,active,Old Sultan (Grimm KHM 48 partial),https://sites.pitt.edu/~dash/type0178a.html,Overlaps with 101; dog stage-manages a rescue to win human favor.
327A,Hansel and Gretel,Tales of Magic,Supernatural Adversaries,active,"""Hänsel und Gretel"" / ""Hansel and Gretel"" (Grimm KHM 15); ""Nennillo and Nennella"" (Basile, Pentamerone V.8); ""Finette Cendron"" (d'Aulnoy, partial); ""The Lost Children"" (Sébillot)",Wikipedia: Hansel and Gretel; SurLaLune; Ashliman type 327A,
511A,The Little Red Ox,Tales of Magic,Supernatural Helpers,active,"English and Scottish variants; ""The Little Red Bull"" (Jacobs, More English Fairy Tales)",Claude (model knowledge),
326B*,The Youth and the Corpse,Tales of Magic,Supernatural Adversaries,active,"Icelandic ""Sagan af Hildi góðu stjúpu"" family; Norse grave-watch tales",Manchester Hive tale-type index,
326A*,Soul Released from Torment,Tales of Magic,Supernatural Adversaries,active,—,Manchester Hive tale-type index,
510B,"The Dress of Gold, of Silver, and of Stars (Cap o' Rushes)",Tales of Magic,Supernatural Helpers,active,"""Allerleirauh"" / ""All-Kinds-of-Fur"" (Grimm KHM 65); ""Peau d'Âne"" / ""Donkeyskin"" (Perrault, 1694); ""Cap o' Rushes"" (English, Jacobs); ""The She-Bear"" / ""L'orsa"" (Basile, Pentamerone II.6); ""Catskin"" (English)",Claude (model knowledge),The unnatural-love variant of 510; heroine flees incestuous father.
510A,Cinderella,Tales of Magic,Supernatural Helpers,active,"""Cendrillon"" (Perrault, 1697); ""Aschenputtel"" / ""Cinderella"" (Grimm KHM 21); ""La Gatta Cenerentola"" / ""The Cat Cinderella"" (Basile, Pentamerone I.6); ""Ye Xian"" (Tang Dynasty Chinese, Duan Chengshi, c. 860 CE); ""Rhodopis"" (Greco-Egyptian, Strabo and Aelian); ""Katie Woodencloak"" (Asbjørnsen & Moe); ""Finette Cendron"" (d'Aulnoy)",Claude (model knowledge),"Among the most widely distributed tale types globally; over 1,500 variants catalogued."
480D*,The Kind Girl and the Frogs,Tales of Magic,Supernatural Tasks,active,—,Claude (model knowledge),
480C*,The Small Red Ox,Tales of Magic,Supernatural Tasks,active,Scandinavian and Finnish variants,Claude (model knowledge),
313B,"The Girl Helps the Hero Flee (""Nothing-in-the-World"" opening)",Tales of Magic,Supernatural Adversaries,active,"East Slavic, Serbo-Croatian, Czech, Lithuanian, Estonian, Finnish, Flemish, French, Scottish, Irish variants; Afanasyev nos. 219-226 (partial)",Wikipedia: The Sea Tsar and Vasilisa the Wise,
313C,"The Magic Flight with ""Forgotten Fiancée"" Ending",Tales of Magic,Supernatural Adversaries,active,"""The Sea Tsar and Vasilisa the Wise"" (Afanasyev); ""Sweetheart Roland"" / ""Der Liebste Roland"" (Grimm KHM 56); ""The True Bride"" (Grimm KHM 186 partial)",Wikipedia: The Sea Tsar and Vasilisa the Wise; Wikipedia: The Master Maid,
460B,The Journey in Search of Fortune,Tales of Magic,Supernatural Tasks,active,"""The Three Hairs from the Devil's Grandmother"" variants; ""What is the Fastest Thing in the World?"" tales",Claude (model knowledge),
461A,The Pilgrimage to the Lord of the Winds,Tales of Magic,Supernatural Tasks,active,—,Claude (model knowledge),
315A,The Cannibal Sister,Tales of Magic,Supernatural Adversaries,active,—,Manchester Hive tale-type index,
465A,The Quest for the Unknown,Tales of Magic,Supernatural Tasks,active,"Russian variants of ""Go I Know Not Whither""",Claude (model knowledge),
513A,Six Go Through the Whole World,Tales of Magic,Supernatural Helpers,active,"""Sechse kommen durch die ganze Welt"" / ""How Six Made Their Way in the World"" (Grimm KHM 71); ""Long, Broad and Sharpsight"" (Czech)",Claude (model knowledge),
470A,The Offended Skull (Statue),Tales of Magic,Supernatural Tasks,active,Don Juan / stone-guest tradition; medieval skull-legend variants,Claude (model knowledge),"Literary descendant: Tirso de Molina's ""El burlador de Sevilla"" (1630) and Mozart's Don Giovanni (1787)."
1960K,The Great Bread,Anecdotes and Jokes,Tall Tales,active,—,Claude (model knowledge),
1960M,The Great Insect,Anecdotes and Jokes,Tall Tales,active,—,Claude (model knowledge),
1960Z,Other Lies About Great Objects,Anecdotes and Jokes,Tall Tales,active,—,Claude (model knowledge),
470B,The Country Where No One Dies,Tales of Magic,Supernatural Tasks,active,"Italian and Balkan ""Land of the Deathless"" variants",Claude (model knowledge),
471A,The Monk and the Bird,Tales of Magic,Supernatural Tasks,active,Medieval Christian legend of the monk Felix/Herlaus listening to a heavenly bird for what seems a moment but is 100-300 years,Claude (model knowledge),
480A*,The Kind and the Unkind Girls (parallel variant),Tales of Magic,Supernatural Tasks,active,—,Claude (model knowledge),
1960J,The Great Bird,Anecdotes and Jokes,Tall Tales,active,—,Claude (model knowledge),
328A,Jack and the Beanstalk,Tales of Magic,Supernatural Adversaries,active,"""Jack and the Beanstalk"" (Joseph Jacobs, English Fairy Tales); ""The History of Jack and the Bean-Stalk"" (Tabart 1807)",Wikipedia: Jack and the Beanstalk; Missouri Libraries; Ashliman type 328A,
328A*,"Three Brothers Steal Back Sun, Moon, and Stars",Tales of Magic,Supernatural Adversaries,active,Balkan and Slavic variants (dragon/serpent steals luminaries),TV Tropes ATU reference; Manchester Hive,
513B,The Land and Water Ship,Tales of Magic,Supernatural Helpers,active,"""The Fool of the World and the Flying Ship"" (Russian, Afanasyev, Lang Yellow Fairy Book)",Claude (model knowledge),
2022B,,Formula Tales,Cumulative Tales,unassigned,,,
650B,The Strong Man Cannot Be Killed,Tales of Magic,Supernatural Power or Knowledge,active,—,Claude (model knowledge),
652A,The Magic Rifle,Tales of Magic,Supernatural Power or Knowledge,active,—,Claude (model knowledge),
653A,The Rarest Thing in the World,Tales of Magic,Supernatural Power or Knowledge,active,—,Claude (model knowledge),
655A,The Strayed Camel and the Clever Deductions,Tales of Magic,Supernatural Power or Knowledge,active,"Origin tale of the ""Three Princes of Serendip"" (Italian, Armeno 1557, origin of the word 'serendipity'); related to Voltaire's Zadig (literary descendant)",Claude (model knowledge),
700A,Daumesdick,Tales of Magic,Other Tales of the Supernatural,uncertain,—,Claude (model knowledge),Possible subtype; low confidence.
2022A,The Death of the Little Hen,Formula Tales,Cumulative Tales,active,"""Von dem Tod des Hühnchens"" (Grimm KHM 80)",Claude (model knowledge),
2029A,,Formula Tales,Cumulative Tales,unassigned,,,
2030B,The Fox Wants His Tail,Formula Tales,Cumulative Tales,active,—,Claude (model knowledge),
2034C,Lending and Repaying: Progressively Worse,Formula Tales,Cumulative Tales,active,—,Claude (model knowledge),
2030C,The Sparrow Wants His Tooth Back,Formula Tales,Cumulative Tales,active,—,Claude (model knowledge),
2034B,The Sky is Falling,Formula Tales,Cumulative Tales,active,"""Chicken Little"" / ""Henny Penny"" (Jacobs, English Fairy Tales)",Claude (model knowledge),Overlap with 2033.
2034A,What the Cow Said to the Calf,Formula Tales,Cumulative Tales,active,—,Claude (model knowledge),
2031C,The Louse Seeks a Wife,Formula Tales,Cumulative Tales,active,—,Claude (model knowledge),
2030A,The Hen is Crushing Nuts,Formula Tales,Cumulative Tales,active,—,Claude (model knowledge),
214B,The Donkey in the Lion's Skin,Animal Tales,Domestic Animals,active,,https://www.artandpopularculture.com/Aarne-Thompson,Specific subtype of 214.
2021A,Hen Dies for Grief; Mourners Die in Succession,Formula Tales,Cumulative Tales,active,"""The Cat and the Mouse in Partnership"" partial overlap (Grimm KHM 2, different type)",Claude (model knowledge),
2010II,Had Gadya (One Kid),Formula Tales,Cumulative Tales,active,"""Had Gadya"" / ""Chad Gadya"" (Passover Haggadah, Aramaic cumulative song, 16th c.); ""The Old Woman and Her Pig"" (English, Jacobs) structural parallel; ""The House That Jack Built"" (English nursery tradition, 1755) structural parallel",Claude (model knowledge),One of the most widely circulated cumulative tale structures in folk tradition.
516A,The Sign Language of the Princess,Tales of Magic,Supernatural Helpers,active,—,Claude (model knowledge),
516B,The Abducted Princess (Love Through Sight of a Floating Hair),Tales of Magic,Supernatural Helpers,active,1001 Nights variants,Claude (model knowledge),
1962B,The Great Wind,Anecdotes and Jokes,Tall Tales,active,—,Claude (model knowledge),
516C,St. James of Galicia,Tales of Magic,Supernatural Helpers,active,Iberian pilgrimage legend,Claude (model knowledge),
530A,The Pigs of the Sea King,Tales of Magic,Supernatural Helpers,active,—,Claude (model knowledge),
545A,The Cat Castle,Tales of Magic,Supernatural Helpers,active,—,Claude (model knowledge),
2018A,,Formula Tales,Cumulative Tales,unassigned,,,
