ATU_Number,Title,Category,Subsection,Status,Exemplar_Tales,Sources,Notes
890,A Pound of Flesh,Realistic Tales,Woman Marries Prince,active,"""The Merchant of Venice"" (Shakespeare, literary descendant, c. 1596); ""Il Pecorone"" (Ser Giovanni Fiorentino, 14th c.); ""Gesta Romanorum"" medieval collection",Claude (model knowledge),
891,The Man Who Deserted His Wife,Realistic Tales,Woman Marries Prince,active,—,Claude (model knowledge),
892,The Children of the King (The Language of Animals),Realistic Tales,Woman Marries Prince,active,—,Claude (model knowledge),
893,The Unreliable Friends (The Half-Friend),Realistic Tales,Woman Marries Prince,active,"""The Half-Friend"" (medieval exemplum, ""Disciplina Clericalis"" of Petrus Alfonsi, c. 1110)",Claude (model knowledge),
894,The Ghoulish Schoolmaster and the Stone of Pity,Realistic Tales,Woman Marries Prince,active,"""The Stone of Pity"" tradition; Greek and Iberian variants",Claude (model knowledge),
895-899,,Realistic Tales,Woman Marries Prince,unassigned,,,End of Woman Marries Prince subsection.
900,King Thrushbeard,Realistic Tales,Proofs of Fidelity,active,"""König Drosselbart"" / ""King Thrushbeard"" (Grimm KHM 52); ""Cannetella"" (Basile, Pentamerone III.1, partial); Catalan and Italian haughty-princess variants",Claude (model knowledge),Proud princess is humbled by being forced into marriage with beggar/minstrel who turns out to be the prince she rejected.
901,Taming of the Shrew,Realistic Tales,Proofs of Fidelity,active,"""Shakespeare's The Taming of the Shrew (literary descendant, c. 1590-92); ""Of the Woman Who Was Tamed""; Spanish ""El conde Lucanor"" (Juan Manuel, 14th c.)",Claude (model knowledge),
902,Taming the Shrew: Cutting Off Her Hair,Realistic Tales,Proofs of Fidelity,active,—,Claude (model knowledge),
903,The Slave Who Claims to Be the Son of a King,Realistic Tales,Proofs of Fidelity,active,—,Claude (model knowledge),
904-909,,Realistic Tales,Proofs of Fidelity,unassigned,,,End of short Proofs of Fidelity subsection.
910,Wise Maxims Bought or Received,Realistic Tales,Clever Acts and Words,active,"""Die klugen Leute"" / ""Clever People"" (Grimm KHM 104); ""The Three Pieces of Good Advice"" tradition; Old Norse ""Hávamál"" (maxim tradition)",Claude (model knowledge),
911,The Wisdom of Hiding One's Wealth,Realistic Tales,Clever Acts and Words,active,—,Claude (model knowledge),
911*,Wisdom Through Suffering,Realistic Tales,Clever Acts and Words,active,—,Claude (model knowledge),
912,,Realistic Tales,Clever Acts and Words,unassigned,,,
913,The Three Brothers Inherit,Realistic Tales,Clever Acts and Words,active,"""The Three Brothers"" inheritance-wisdom tales; Solomon's judgment analogues",Claude (model knowledge),
914,,Realistic Tales,Clever Acts and Words,unassigned,,,
915,Clever Advice (parent type),Realistic Tales,Clever Acts and Words,active,Parent type; most attestations fall under lettered subtypes (915A etc.),Claude (model knowledge),
916,The Bodyguards,Realistic Tales,Clever Acts and Words,active,—,Claude (model knowledge),
917,,Realistic Tales,Clever Acts and Words,unassigned,,,
918-919,,Realistic Tales,Clever Acts and Words,unassigned,,,
920,The Son of the King and the Son of the Smith,Realistic Tales,Clever Acts and Words,active,"""Solomon and the wise child"" legend (1 Kings 3, biblical antecedent); medieval 'judgment of Solomon' analogues",Claude (model knowledge),
921,The King and the Peasant's Son,Realistic Tales,Clever Acts and Words,active,"""Die kluge Antwort"" variants; clever-child-answers-king tales",Claude (model knowledge),
922,The Shepherd Substituting for the Priest Answers the King's Questions (King John and the Bishop),Realistic Tales,Clever Acts and Words,active,"""King John and the Bishop"" (Child ballad 45); ""The Abbot of Canterbury"" tradition; Italian and German ""Der Kaiser und der Abt"" (Bürger ballad, literary); 1001 Nights analogues",Claude (model knowledge),Shepherd answers king's impossible riddles that the bishop couldn't; widely distributed.
923,Love Like Salt,Realistic Tales,Clever Acts and Words,active,"""Cap o' Rushes"" (English, Jacobs); Shakespeare's King Lear (literary descendant, partial); ""The Goose Girl at the Spring"" overlap (870A); ""Like Meat Loves Salt"" variants",Claude (model knowledge),
924,Discussion by Sign Language,Realistic Tales,Clever Acts and Words,active,"Medieval disputation-by-gestures tradition; Rabelais 'Thaumaste' episode (literary, Pantagruel)",Claude (model knowledge),
925,,Realistic Tales,Clever Acts and Words,unassigned,,,
926,Judgment of Solomon,Realistic Tales,Clever Acts and Words,active,"""The Judgment of Solomon"" (1 Kings 3:16-28, biblical antecedent); ""Die Kinderprobe"" tradition; Brecht's Caucasian Chalk Circle (literary descendant)",Claude (model knowledge),
927,Out-Riddling the Judge,Realistic Tales,Clever Acts and Words,active,—,Claude (model knowledge),
928-929,,Realistic Tales,Clever Acts and Words,unassigned,,,End of Clever Acts and Words subsection.
930,The Prophecy,Realistic Tales,Tales of Fate,active,"""The Devil with the Three Golden Hairs"" overlap (461); ""The Fisherman and the Rich Man"" variants; ""Oedipus"" legend (classical antecedent)",Claude (model knowledge),Prophecy that poor child will marry princess / inherit kingdom; attempts to prevent fail.
931,Oedipus,Realistic Tales,Tales of Fate,active,"""Oedipus Rex"" (Sophocles, 5th c. BCE, literary antecedent); medieval Judas legends; Albanian and Russian Oedipus variants",Claude (model knowledge),
932,,Realistic Tales,Tales of Fate,unassigned,,,
933,Gregorius on the Stone,Realistic Tales,Tales of Fate,active,"""Gregorius"" (Hartmann von Aue, Middle High German, c. 1190, literary); Pope Gregory legend",Claude (model knowledge),
934,Tales of the Predestined Death,Realistic Tales,Tales of Fate,active,"""Oleg the Wise"" / death-by-horse-skull legend (Primary Russian Chronicle); Pushkin's ""Song of Oleg"" (literary); Greek myths of Meleager",Claude (model knowledge),
935,,Realistic Tales,Tales of Fate,unassigned,,,
936*,The Golden Mountain (Tales of Magic variant),Realistic Tales,Tales of Fate,active,"""Der König vom goldenen Berge"" / ""The King of the Golden Mountain"" (Grimm KHM 92)",Claude (model knowledge),
936,The Golden Mountain,Realistic Tales,Tales of Fate,active,—,Claude (model knowledge),Partial overlap with Tales of Magic 936* and treasure-mountain tales.
937,,Realistic Tales,Tales of Fate,unassigned,,,
938,Placidas (Eustacius),Realistic Tales,Tales of Fate,active,"""St. Eustace/Placidus"" hagiographic legend (medieval Christian); ""The Man Tried by Fate"" tradition",Claude (model knowledge),
939-944,,Realistic Tales,Tales of Fate,unassigned,,,
945,Luck and Intelligence,Realistic Tales,Tales of Fate,active,—,Claude (model knowledge),
946-949,,Realistic Tales,Tales of Fate,unassigned,,,End of Tales of Fate subsection.
950,Rhampsinitus,Realistic Tales,Robbers and Murderers,active,"""Rhampsinitus and the Thief"" (Herodotus, Histories Book II, 5th c. BCE, literary antecedent); Egyptian and Near Eastern master-thief traditions; medieval European variants",Claude (model knowledge),"The Master Thief cycle; thief outwits king, escapes capture repeatedly, wins princess."
951,The King and the Robber,Realistic Tales,Robbers and Murderers,active,—,Claude (model knowledge),
952,The King and the Soldier,Realistic Tales,Robbers and Murderers,active,—,Claude (model knowledge),
953,The Old Robber and Killer Narrates Three of His Adventures,Realistic Tales,Robbers and Murderers,active,—,Claude (model knowledge),
954,The Forty Thieves,Realistic Tales,Robbers and Murderers,active,"""Ali Baba and the Forty Thieves"" (1001 Nights, Galland 1710s); overlap with 676",Claude (model knowledge),
955,The Robber Bridegroom,Realistic Tales,Robbers and Murderers,active,"""Der Räuberbräutigam"" / ""The Robber Bridegroom"" (Grimm KHM 40); ""Mr. Fox"" (English, Jacobs); ""The Story of Mr. Fox"" in Shakespeare's Much Ado About Nothing reference; Southern US ""Robber Bridegroom"" variants",Claude (model knowledge),
956,The Hot Chamber of the Murderous Robbers,Realistic Tales,Robbers and Murderers,active,—,Claude (model knowledge),
957,,Realistic Tales,Robbers and Murderers,unassigned,,,
958,The Shepherd Youth in the Robber's Power,Realistic Tales,Robbers and Murderers,active,—,Claude (model knowledge),
959,,Realistic Tales,Robbers and Murderers,unassigned,,,
960,The Sun Brings All to Light,Realistic Tales,Robbers and Murderers,active,"""Die klare Sonne bringt's an den Tag"" / ""The Bright Sun Brings It to Light"" (Grimm KHM 115); ""The Cranes of Ibycus"" overlap (780C)",Claude (model knowledge),
961,The Shepherd Who Made Sure (parent type),Realistic Tales,Robbers and Murderers,active,Parent type; most attestations under 961A,Claude (model knowledge),
962,,Realistic Tales,Robbers and Murderers,unassigned,,,
963,Innocent Man Pardoned by Lot,Realistic Tales,Robbers and Murderers,active,—,Claude (model knowledge),
964,,Realistic Tales,Robbers and Murderers,unassigned,,,
965,,Realistic Tales,Robbers and Murderers,unassigned,,,
966,,Realistic Tales,Robbers and Murderers,unassigned,,,
967,The Man Saved by a Spider's Web,Realistic Tales,Robbers and Murderers,active,"""Frederick the Great and the spider"" legend; ""Robert the Bruce and the spider"" (Scottish legend, 14th c.); Islamic tradition of the spider protecting Muhammad in the Cave of Thawr; widespread as historical-patriotic legend",Claude (model knowledge),
968,,Realistic Tales,Robbers and Murderers,unassigned,,,
969-969*,,Realistic Tales,Robbers and Murderers,unassigned,,,
970*,Tree from Grave,Realistic Tales,Other Realistic Tales,active,—,Claude (model knowledge),
970,The Twining Branches,Realistic Tales,Other Realistic Tales,active,"""Tristan and Iseult"" motif of intertwining trees on lovers' graves (medieval romance); Child ballad 73 ""Lord Thomas and Fair Annet"" (intertwining briars); Chinese ""Butterfly Lovers"" (Liang Shanbo and Zhu Yingtai) as parallel",Claude (model knowledge),
971,,Realistic Tales,Other Realistic Tales,unassigned,,,
972,,Realistic Tales,Other Realistic Tales,unassigned,,,
973,,Realistic Tales,Other Realistic Tales,unassigned,,,
974,The Homecoming Husband (The Returning Husband),Realistic Tales,Other Realistic Tales,active,"""Odyssey"" (Homer, Books 13-23, literary antecedent, 8th c. BCE); Enoch Arden legend (Tennyson's poem, 1864, literary descendant); medieval 'returning crusader' ballads",Claude (model knowledge),
975,,Realistic Tales,Other Realistic Tales,unassigned,,,
976,Which Was the Noblest Act?,Realistic Tales,Other Realistic Tales,active,"""The Franklin's Tale"" (Chaucer, Canterbury Tales, literary antecedent); Boccaccio's Decameron X.5 ""The Garden of January""",Claude (model knowledge),
977,,Realistic Tales,Other Realistic Tales,unassigned,,,
978,The Youth in the Land of the Cheaters,Realistic Tales,Other Realistic Tales,active,—,Claude (model knowledge),
979,The Bear Trainer and His Bear Save the Sleeper from the Snake,Realistic Tales,Other Realistic Tales,active,—,Claude (model knowledge),
980,The Ungrateful Son (Ingratitude Punished),Realistic Tales,Other Realistic Tales,active,"""Der undankbare Sohn"" / ""The Ungrateful Son"" (Grimm KHM 145); ""The Old Man and His Grandson"" / ""Der alte Großvater und der Enkel"" (Grimm KHM 78)",Claude (model knowledge),
981,Wisdom of Hidden Old Man Saves Kingdom,Realistic Tales,Other Realistic Tales,active,"""Old Sultan"" / ""Der alte Sultan"" (Grimm KHM 48, partial overlap); Japanese ""Obasute"" (grandmother-abandonment-tradition-reversed tales)",Claude (model knowledge),
982,The Supposed Treasure Box,Realistic Tales,Other Realistic Tales,active,—,Claude (model knowledge),
983,The Dishes of the Same Flavor,Realistic Tales,Other Realistic Tales,active,—,Claude (model knowledge),
984,,Realistic Tales,Other Realistic Tales,unassigned,,,
985,Brother Chosen Rather than Husband or Son,Realistic Tales,Other Realistic Tales,active,"""Intaphernes' wife"" (Herodotus, Histories III.119, 5th c. BCE); Sophocles' Antigone (classical antecedent)",Claude (model knowledge),
986-987,,Realistic Tales,Other Realistic Tales,unassigned,,,
988,Starving Gypsy Pretends to Commit Suicide,Realistic Tales,Other Realistic Tales,active,—,Claude (model knowledge),
989,The Poor Man's Bones Are Used for a Hoop,Realistic Tales,Other Realistic Tales,active,—,Claude (model knowledge),
990,The Seemingly Dead Revives,Realistic Tales,Other Realistic Tales,active,Overlap with 885A; revival-from-apparent-death tales,Claude (model knowledge),
991-999,,Realistic Tales,Other Realistic Tales,unassigned,,,End of Realistic Tales category. Catalogue resumes at 1000 opening the Tales of the Stupid Ogre category.
1000,Bargain Not to Become Angry,Stupid Ogre,Labor Contract,active,"""The Devil and the Peasant"" / ""Peasant's Bargain"" tradition; ""The Master and the Servant Who Must Not Be Angry"" variants; Russian trickster-tales (Afanasyev)",Claude (model knowledge),Trickster (usually peasant) agrees with master/devil/ogre to bargain: first to show anger forfeits heavy penalty. Central type of the Labor Contract cycle.
1001,Bargain to Eat No Other Food,Stupid Ogre,Labor Contract,active,—,Claude (model knowledge),
1002,Dissipation of the Ogre's Property,Stupid Ogre,Labor Contract,active,—,Claude (model knowledge),
1003,Plowing,Stupid Ogre,Labor Contract,active,—,Claude (model knowledge),Trickster instructed to plow destroys the ogre's field.
1004,Hogs in the Mud (Sheep in the Air),Stupid Ogre,Labor Contract,active,"""Little Claus and Big Claus"" / ""Lille Claus og store Claus"" (Andersen, 1835, partial overlap with 1535); trickster-sells-ogre-on-invisible-livestock tradition",Claude (model knowledge),
1005,Building a Bridge,Stupid Ogre,Labor Contract,active,—,Claude (model knowledge),
1006,Casting Eyes,Stupid Ogre,Labor Contract,active,—,Claude (model knowledge),Literal-minded peasant throws actual eyes at the ogre's flock when told to 'cast eyes' over them.
1007,Other Injuries to Domestic Animals,Stupid Ogre,Labor Contract,active,—,Claude (model knowledge),
1008,,Stupid Ogre,Labor Contract,unassigned,,,
1009,Guarding the Store-Room or House,Stupid Ogre,Labor Contract,active,—,Claude (model knowledge),
1010,Repairing the Barn,Stupid Ogre,Labor Contract,active,—,Claude (model knowledge),
1011,Tearing Down the Barn,Stupid Ogre,Labor Contract,active,—,Claude (model knowledge),
1012,Cleaning the Child,Stupid Ogre,Labor Contract,active,—,Claude (model knowledge),Grotesque literal interpretation — often involves washing/boiling the child.
1013,Bathing or Warming Grandmother (the Old One),Stupid Ogre,Labor Contract,active,—,Claude (model knowledge),
1014,,Stupid Ogre,Labor Contract,unassigned,,,
1015,,Stupid Ogre,Labor Contract,unassigned,,,
1016-1029,,Stupid Ogre,Labor Contract,unassigned,,,
1030,The Crop Division,Stupid Ogre,Partnership Between Man and Ogre,active,"""The Peasant and the Devil"" / ""Der Bauer und der Teufel"" (Grimm KHM 189); Aesop-style bear-and-farmer crop-division tales; Joel Chandler Harris's Br'er Rabbit-and-bear variants",Claude (model knowledge),Man agrees with bear/devil/giant to split crop (above-ground vs. below-ground); trickster plants whatever gives him the valuable part.
1031,Granary Roof Used as Threshing Flail,Stupid Ogre,Partnership Between Man and Ogre,active,—,Claude (model knowledge),
1032-1035,,Stupid Ogre,Partnership Between Man and Ogre,unassigned,,,
1036,Hogs with Curly Tails,Stupid Ogre,Partnership Between Man and Ogre,active,—,Claude (model knowledge),
1037-1044,,Stupid Ogre,Partnership Between Man and Ogre,unassigned,,,
1045,Pulling the Lake Together,Stupid Ogre,Partnership Between Man and Ogre,active,"""Bearskin"" partial; trickster-vs-devil contest tradition",Claude (model knowledge),
1046-1049,,Stupid Ogre,Partnership Between Man and Ogre,unassigned,,,
1050,Felling Trees,Stupid Ogre,Partnership Between Man and Ogre,active,—,Claude (model knowledge),
1051,Springing a Tree,Stupid Ogre,Partnership Between Man and Ogre,active,"""Das tapfere Schneiderlein"" / ""The Brave Little Tailor"" partial (Grimm KHM 20, overlap with 1640)",Claude (model knowledge),
1052,Deceptive Contest in Carrying a Tree (Horse),Stupid Ogre,Partnership Between Man and Ogre,active,"""The Brave Little Tailor"" partial (Grimm KHM 20)",Claude (model knowledge),
1053-1059,,Stupid Ogre,Partnership Between Man and Ogre,unassigned,,,
1060,Squeezing the (Supposed) Stone,Stupid Ogre,Contest Between Man and Ogre,active,"""Das tapfere Schneiderlein"" / ""The Brave Little Tailor"" (Grimm KHM 20); ""The Valiant Little Tailor"" tradition; ""Jack the Giant Killer"" (English)",Claude (model knowledge),Tailor squeezes cheese while pretending it's a stone; deceives giant with fake strength.
1061,Biting Stones,Stupid Ogre,Contest Between Man and Ogre,active,—,Claude (model knowledge),
1062,Throwing a Stone,Stupid Ogre,Contest Between Man and Ogre,active,"""The Brave Little Tailor"" (Grimm KHM 20, partial)",Claude (model knowledge),
1063,Throwing Contest with a Golden Club,Stupid Ogre,Contest Between Man and Ogre,active,—,Claude (model knowledge),
1064,,Stupid Ogre,Contest Between Man and Ogre,unassigned,,,
1065-1070,,Stupid Ogre,Contest Between Man and Ogre,unassigned,,,
1071,Wrestling Match with the Bear,Stupid Ogre,Contest Between Man and Ogre,active,"""The Brave Little Tailor"" (Grimm KHM 20, partial)",Claude (model knowledge),
1072,Race with the Hare,Stupid Ogre,Contest Between Man and Ogre,active,—,Claude (model knowledge),Distinct from the Hare and Tortoise (ATU 275) despite thematic overlap.
1073,,Stupid Ogre,Contest Between Man and Ogre,unassigned,,,
1074,Race Won by Deception (The Hedgehog and the Hare),Stupid Ogre,Contest Between Man and Ogre,active,"""Der Hase und der Igel"" / ""The Hare and the Hedgehog"" (Grimm KHM 187)",Claude (model knowledge),
1075-1083,,Stupid Ogre,Contest Between Man and Ogre,unassigned,,,
1084,,Stupid Ogre,Contest Between Man and Ogre,unassigned,,,
1085,Pushing a Hole in a Tree,Stupid Ogre,Contest Between Man and Ogre,active,—,Claude (model knowledge),
1086,,Stupid Ogre,Contest Between Man and Ogre,unassigned,,,
1087,Rowing Contest,Stupid Ogre,Contest Between Man and Ogre,active,—,Claude (model knowledge),
1088,Eating Contest,Stupid Ogre,Contest Between Man and Ogre,active,"""The Brave Little Tailor"" partial; bag-hidden-in-clothing motif",Claude (model knowledge),
1089,,Stupid Ogre,Contest Between Man and Ogre,unassigned,,,
1090,Mowing Contest,Stupid Ogre,Contest Between Man and Ogre,active,—,Claude (model knowledge),
1091,Who Can Bring an Unheard-of Riding-Horse?,Stupid Ogre,Contest Between Man and Ogre,active,"""Die Kluge Antwort"" tradition; peasant-rides-pig to king variants",Claude (model knowledge),
1092-1093,,Stupid Ogre,Contest Between Man and Ogre,unassigned,,,
1094,Contest in Smoke-Blowing,Stupid Ogre,Contest Between Man and Ogre,active,—,Claude (model knowledge),
1095,Scratching With the Long Fingernails,Stupid Ogre,Contest Between Man and Ogre,active,—,Claude (model knowledge),
1096,The Tailor and the Ogre in a Sewing Contest,Stupid Ogre,Contest Between Man and Ogre,active,—,Claude (model knowledge),
1097-1114,,Stupid Ogre,Contest Between Man and Ogre,unassigned,,,
1115,Attempted Murder with Hatchet,Stupid Ogre,Man Kills (Injures) Ogre,active,"""The Brave Little Tailor"" (Grimm KHM 20); ""Jack the Giant Killer"" variants",Claude (model knowledge),
1116,Attempted Burning,Stupid Ogre,Man Kills (Injures) Ogre,active,—,Claude (model knowledge),
1117,The Ogre's Pitfall,Stupid Ogre,Man Kills (Injures) Ogre,active,—,Claude (model knowledge),
1118,,Stupid Ogre,Man Kills (Injures) Ogre,unassigned,,,
1119,The Ogre Kills His Own Children,Stupid Ogre,Man Kills (Injures) Ogre,active,"""Hansel and Gretel"" partial (327A); ""Le Petit Poucet"" / ""Hop o' My Thumb"" (Perrault, partial overlap with 327B) — ogre's daughters killed by mistake",Claude (model knowledge),
1120,The Ogre's Wife Thrown into the Water,Stupid Ogre,Man Kills (Injures) Ogre,active,—,Claude (model knowledge),
1121,Ogre's Wife Burned in Her Own Oven,Stupid Ogre,Man Kills (Injures) Ogre,active,"""Hansel and Gretel"" (Grimm KHM 15, central motif)",Claude (model knowledge),
1122,Ogre's Wife Killed Through Other Tricks,Stupid Ogre,Man Kills (Injures) Ogre,active,—,Claude (model knowledge),
1123,Stones (Hot Porridge) Dropped into the Ogre's Throat,Stupid Ogre,Man Kills (Injures) Ogre,active,—,Claude (model knowledge),
1124-1129,,Stupid Ogre,Man Kills (Injures) Ogre,unassigned,,,
1130,Counting Out Pay (Money in the Hat),Stupid Ogre,Man Kills (Injures) Ogre,active,—,Claude (model knowledge),
1131,The Hot Porridge in the Ogre's Throat,Stupid Ogre,Man Kills (Injures) Ogre,active,—,Claude (model knowledge),
1132,Flight of the Ogre with the Would-Be Thieves,Stupid Ogre,Man Kills (Injures) Ogre,active,—,Claude (model knowledge),
1133,Making the Ogre Strong: Castration,Stupid Ogre,Man Kills (Injures) Ogre,active,"Polyphemus analogue in the Odyssey (Book 9, literary antecedent); ""No-Man"" / ""Outis"" deception",Claude (model knowledge),
1134-1136,,Stupid Ogre,Man Kills (Injures) Ogre,unassigned,,,
1137,The Blinded Ogre (Polyphemus),Stupid Ogre,Man Kills (Injures) Ogre,active,"""The Odyssey"" Book 9 — Odysseus and Polyphemus (Homer, 8th c. BCE, literary antecedent); Georgian ""The One-Eyed Ogre""; Caucasian ""Devi"" tales; Armenian variants",Claude (model knowledge),One of the oldest attested tale types in European tradition; Homeric antecedent.
1138-1144,,Stupid Ogre,Man Kills (Injures) Ogre,unassigned,,,
1145,The Ogre Frightened by Threats,Stupid Ogre,Ogre Frightened by Man,active,—,Claude (model knowledge),
1146,Capturing the Ogre,Stupid Ogre,Ogre Frightened by Man,active,—,Claude (model knowledge),
1147,Man Frightens Ogre with Lightning and Thunder,Stupid Ogre,Ogre Frightened by Man,active,—,Claude (model knowledge),
1148,Thunder Instrument Disturbs the Ogre,Stupid Ogre,Ogre Frightened by Man,active,—,Claude (model knowledge),
1149,Children Desire the Ogre's Flesh,Stupid Ogre,Ogre Frightened by Man,active,—,Claude (model knowledge),
1150-1154,,Stupid Ogre,Ogre Frightened by Man,unassigned,,,
1155,Blinding the Ogre,Stupid Ogre,Man Outwits the Devil,active,Polyphemus-type overlap (1137),Claude (model knowledge),
1156,The Gun Barrel Bent (False Musket),Stupid Ogre,Man Outwits the Devil,active,—,Claude (model knowledge),
1157,The Gun as Tobacco Pipe,Stupid Ogre,Man Outwits the Devil,active,—,Claude (model knowledge),
1158,The Ogre Wants to Look Through the Gun Barrel at a White Spot,Stupid Ogre,Man Outwits the Devil,active,—,Claude (model knowledge),
1159,The Ogre Cured by a Doctor,Stupid Ogre,Man Outwits the Devil,active,—,Claude (model knowledge),
1160,The Ogre in the Haunted House,Stupid Ogre,Man Outwits the Devil,active,"""Der junge Riese"" partial; Scottish 'bogle-in-the-mill' tradition",Claude (model knowledge),
1161,The Bear Trainer and His Bear,Stupid Ogre,Man Outwits the Devil,active,"""Der Bärenhäuter"" partial; overlap with 1159 and 1160",Claude (model knowledge),
1162,The Ogre Frightened by the Pupils (Dragging the Plow),Stupid Ogre,Man Outwits the Devil,active,—,Claude (model knowledge),
1163,,Stupid Ogre,Man Outwits the Devil,unassigned,,,
1164,The Evil Woman Thrown Into the Pit (Belphegor),Stupid Ogre,Man Outwits the Devil,active,"""Belphegor"" (Machiavelli, novella, 1520s, literary); ""The Devil Who Married a Shrew"" tradition; ""The Devil Visits Hell"" variants",Claude (model knowledge),A shrew-wife so fearsome that the devil himself flees her; influenced literary Belphegor tradition.
1165,The Ogre and the Storm,Stupid Ogre,Man Outwits the Devil,active,—,Claude (model knowledge),
1166,Yoking the Ogre,Stupid Ogre,Man Outwits the Devil,active,—,Claude (model knowledge),
1167,The Ogre Pulled into a Castrated Horse,Stupid Ogre,Man Outwits the Devil,active,—,Claude (model knowledge),
1168,Exorcising the Devil,Stupid Ogre,Man Outwits the Devil,active,—,Claude (model knowledge),
1169,,Stupid Ogre,Man Outwits the Devil,unassigned,,,
1170,A Man Sells His Soul to the Devil,Stupid Ogre,Souls Saved from the Devil,active,"Faustian-pact tales (overlap with 756B); ""The Soldier and the Devil"" variants",Claude (model knowledge),
1171,The Devil's Contract,Stupid Ogre,Souls Saved from the Devil,active,"Overlap with 756B; ""Soldier-outwits-devil"" tales widespread in European tradition",Claude (model knowledge),
1172,Impossible Tasks Set for the Devil,Stupid Ogre,Souls Saved from the Devil,active,"""Der Teufel und seine Großmutter"" / ""The Devil and His Grandmother"" (Grimm KHM 125)",Claude (model knowledge),
1173,The Devil Invoked Must Remain Until the Last Comes,Stupid Ogre,Souls Saved from the Devil,active,—,Claude (model knowledge),
1174,Making a Rope of Sand,Stupid Ogre,Souls Saved from the Devil,active,Medieval exempla 'rope of sand' impossible task,Claude (model knowledge),
1175,Straightening the Curly Hair,Stupid Ogre,Souls Saved from the Devil,active,—,Claude (model knowledge),
1176,Catching a Fart,Stupid Ogre,Souls Saved from the Devil,active,—,Claude (model knowledge),
1177,The Last Task: Breaking the Devil's Nose,Stupid Ogre,Souls Saved from the Devil,active,—,Claude (model knowledge),
1178,Grandmother-Devil Outwitted,Stupid Ogre,Souls Saved from the Devil,active,—,Claude (model knowledge),
1179,,Stupid Ogre,Souls Saved from the Devil,unassigned,,,
1180,Catching Water in a Sieve,Stupid Ogre,Souls Saved from the Devil,active,"""The Maiden and the Sieve"" tradition; Danaides in Greek myth (classical antecedent)",Claude (model knowledge),
1181,Counting the Stars (Counting Grains of Sand),Stupid Ogre,Souls Saved from the Devil,active,—,Claude (model knowledge),
1182,,Stupid Ogre,Souls Saved from the Devil,unassigned,,,
1183-1184,,Stupid Ogre,Souls Saved from the Devil,unassigned,,,
